[
  {
    "unit_id": "trygon",
    "faction_id": "tyranids",
    "models": [
      {
        "name": "Trygon",
        "min": 1,
        "max": 1,
        "is_leader_model": false,
        "base_size_mm": {
          "shape": "oval",
          "width": 120,
          "length": 92
        },
        "default_weapon_ids": [
          "trygon-scything-talons",
          "bio-electric-pulse"
        ]
      }
    ],
    "game_version": {
      "edition": "11th",
      "dataslate": "pre-launch-provisional"
    },
    "tiers": [
      {
        "models": [
          {
            "name": "Trygon",
            "min": 1,
            "max": 1
          }
        ]
      }
    ]
  },
  {
    "unit_id": "mawloc",
    "faction_id": "tyranids",
    "models": [
      {
        "name": "Mawloc",
        "min": 1,
        "max": 1,
        "is_leader_model": false,
        "base_size_mm": {
          "shape": "oval",
          "width": 120,
          "length": 92
        },
        "default_weapon_ids": [
          "mawloc-scything-talons",
          "distensible-jaw"
        ]
      }
    ],
    "game_version": {
      "edition": "11th",
      "dataslate": "pre-launch-provisional"
    },
    "tiers": [
      {
        "models": [
          {
            "name": "Mawloc",
            "min": 1,
            "max": 1
          }
        ]
      }
    ]
  },
  {
    "unit_id": "tyranid-warriors-with-ranged-bio-weapons",
    "faction_id": "tyranids",
    "models": [
      {
        "name": "Tyranid Prime",
        "profile_name": "Tyranid Warrior",
        "min": 1,
        "max": 1,
        "default_weapon_ids": [
          "tyranid-warrior-claws-and-talons",
          "devourer"
        ],
        "is_leader_model": true,
        "base_size_mm": {
          "shape": "round",
          "diameter": 50
        }
      },
      {
        "name": "Tyranid Warrior",
        "min": 2,
        "max": 5,
        "default_weapon_ids": [
          "tyranid-warrior-claws-and-talons",
          "devourer"
        ],
        "is_leader_model": false,
        "base_size_mm": {
          "shape": "round",
          "diameter": 50
        }
      }
    ],
    "game_version": {
      "edition": "11th",
      "dataslate": "pre-launch-provisional"
    },
    "tiers": [
      {
        "models": [
          {
            "name": "Tyranid Prime",
            "min": 1,
            "max": 1
          },
          {
            "name": "Tyranid Warrior",
            "min": 2,
            "max": 2
          }
        ]
      },
      {
        "models": [
          {
            "name": "Tyranid Prime",
            "min": 1,
            "max": 1
          },
          {
            "name": "Tyranid Warrior",
            "min": 3,
            "max": 5
          }
        ]
      }
    ]
  },
  {
    "unit_id": "winged-hive-tyrant",
    "faction_id": "tyranids",
    "models": [
      {
        "name": "Winged Hive Tyrant",
        "min": 1,
        "max": 1,
        "is_leader_model": false,
        "base_size_mm": {
          "shape": "round",
          "diameter": 60
        },
        "default_weapon_ids": [
          "monstrous-bonesword-and-lash-whip",
          "tyrant-talons"
        ]
      }
    ],
    "game_version": {
      "edition": "11th",
      "dataslate": "pre-launch-provisional"
    },
    "tiers": [
      {
        "models": [
          {
            "name": "Winged Hive Tyrant",
            "min": 1,
            "max": 1
          }
        ]
      }
    ]
  },
  {
    "unit_id": "harridan",
    "faction_id": "tyranids",
    "models": [
      {
        "name": "Harridan",
        "min": 1,
        "max": 1,
        "is_leader_model": false,
        "base_size_mm": {
          "shape": "unique",
          "draft": true
        },
        "default_weapon_ids": [
          "gargantuan-scything-talons",
          "dire-bio-cannon",
          "dire-bio-cannon"
        ]
      }
    ],
    "game_version": {
      "edition": "11th",
      "dataslate": "pre-launch-provisional"
    },
    "tiers": [
      {
        "models": [
          {
            "name": "Harridan",
            "min": 1,
            "max": 1
          }
        ]
      }
    ]
  },
  {
    "unit_id": "norn-emissary",
    "faction_id": "tyranids",
    "models": [
      {
        "name": "Norn Emissary",
        "min": 1,
        "max": 1,
        "is_leader_model": false,
        "base_size_mm": {
          "shape": "round",
          "diameter": 100
        },
        "default_weapon_ids": [
          "psychic-tendril",
          "monstrous-rending-claws",
          "monstrous-scything-talons-norn-emissary"
        ]
      }
    ],
    "game_version": {
      "edition": "11th",
      "dataslate": "pre-launch-provisional"
    },
    "tiers": [
      {
        "models": [
          {
            "name": "Norn Emissary",
            "min": 1,
            "max": 1
          }
        ]
      }
    ]
  },
  {
    "unit_id": "winged-tyranid-prime",
    "faction_id": "tyranids",
    "models": [
      {
        "name": "Winged Tyranid Prime",
        "min": 1,
        "max": 1,
        "is_leader_model": false,
        "base_size_mm": {
          "shape": "round",
          "diameter": 50
        },
        "default_weapon_ids": [
          "prime-talons"
        ]
      }
    ],
    "game_version": {
      "edition": "11th",
      "dataslate": "pre-launch-provisional"
    },
    "tiers": [
      {
        "models": [
          {
            "name": "Winged Tyranid Prime",
            "min": 1,
            "max": 1
          }
        ]
      }
    ]
  },
  {
    "unit_id": "von-ryans-leapers",
    "faction_id": "tyranids",
    "models": [
      {
        "name": "Von Ryan’s Leaper",
        "min": 3,
        "max": 6,
        "is_leader_model": false,
        "base_size_mm": {
          "shape": "round",
          "diameter": 40
        },
        "default_weapon_ids": [
          "leapers-talons"
        ]
      }
    ],
    "game_version": {
      "edition": "11th",
      "dataslate": "pre-launch-provisional"
    },
    "tiers": [
      {
        "models": [
          {
            "name": "Von Ryan’s Leaper",
            "min": 3,
            "max": 3
          }
        ]
      },
      {
        "models": [
          {
            "name": "Von Ryan’s Leaper",
            "min": 4,
            "max": 6
          }
        ]
      }
    ]
  },
  {
    "unit_id": "hierophant",
    "faction_id": "tyranids",
    "models": [
      {
        "name": "Hierophant",
        "min": 1,
        "max": 1,
        "is_leader_model": false,
        "base_size_mm": {
          "shape": "hull",
          "draft": true
        },
        "default_weapon_ids": [
          "titanic-scything-talons",
          "dire-bio-cannon",
          "dire-bio-cannon",
          "bio-plasma-torrent",
          "lashwhip-pods"
        ]
      }
    ],
    "game_version": {
      "edition": "11th",
      "dataslate": "pre-launch-provisional"
    },
    "tiers": [
      {
        "models": [
          {
            "name": "Hierophant",
            "min": 1,
            "max": 1
          }
        ]
      }
    ]
  },
  {
    "unit_id": "the-swarmlord",
    "faction_id": "tyranids",
    "models": [
      {
        "name": "The Swarmlord",
        "min": 1,
        "max": 1,
        "is_leader_model": false,
        "base_size_mm": {
          "shape": "round",
          "diameter": 60
        },
        "default_weapon_ids": [
          "bone-sabres",
          "synaptic-pulse"
        ]
      }
    ],
    "game_version": {
      "edition": "11th",
      "dataslate": "pre-launch-provisional"
    },
    "tiers": [
      {
        "models": [
          {
            "name": "The Swarmlord",
            "min": 1,
            "max": 1
          }
        ]
      }
    ]
  },
  {
    "unit_id": "exocrine",
    "faction_id": "tyranids",
    "models": [
      {
        "name": "Exocrine",
        "min": 1,
        "max": 1,
        "is_leader_model": false,
        "base_size_mm": {
          "shape": "oval",
          "width": 120,
          "length": 92
        },
        "default_weapon_ids": [
          "powerful-limbs",
          "bio-plasmic-cannon"
        ]
      }
    ],
    "game_version": {
      "edition": "11th",
      "dataslate": "pre-launch-provisional"
    },
    "tiers": [
      {
        "models": [
          {
            "name": "Exocrine",
            "min": 1,
            "max": 1
          }
        ]
      }
    ]
  },
  {
    "unit_id": "venomthropes",
    "faction_id": "tyranids",
    "models": [
      {
        "name": "Venomthrope",
        "min": 3,
        "max": 6,
        "is_leader_model": false,
        "base_size_mm": {
          "shape": "round",
          "diameter": 40
        },
        "default_weapon_ids": [
          "toxic-lashes"
        ]
      }
    ],
    "game_version": {
      "edition": "11th",
      "dataslate": "pre-launch-provisional"
    },
    "tiers": [
      {
        "models": [
          {
            "name": "Venomthrope",
            "min": 3,
            "max": 3
          }
        ]
      },
      {
        "models": [
          {
            "name": "Venomthrope",
            "min": 4,
            "max": 6
          }
        ]
      }
    ]
  },
  {
    "unit_id": "tyranid-warriors-with-melee-bio-weapons",
    "faction_id": "tyranids",
    "models": [
      {
        "name": "Tyranid Prime",
        "profile_name": "Tyranid Warrior",
        "min": 1,
        "max": 1,
        "default_weapon_ids": [
          "tyranid-warrior-claws-and-talons-tyranid-warriors-with-melee-bio-weapons"
        ],
        "is_leader_model": true,
        "base_size_mm": {
          "shape": "round",
          "diameter": 50
        }
      },
      {
        "name": "Tyranid Warrior",
        "min": 2,
        "max": 5,
        "default_weapon_ids": [
          "tyranid-warrior-claws-and-talons-tyranid-warriors-with-melee-bio-weapons"
        ],